text@kua1968m	@kua1968m	735.521	742.39	ааа / такой э момент присутствовал но это не являлось причиной ра... распада группы не #смеется#
text@kua1968m	@kua1968m	768.266	769.26	конечно да //
text@kua1968m	@kua1968m	778.379	787.25	нет / на... наверно нет не так потому что история с эээ с акустиками с выступлением под гитару она как бы продолжается параллельно но ааа//
text@kua1968m	@kua1968m	787.371	801.646	ааа когда вот / стали появляться вот эти песни которые в итоге вошли в альбом Новейшая Хронология / мне захотелось / услышать их эээ в электрическом / звучании да? я понял что это песни для электричества созданы это рок-песни //
text@kua1968m	@kua1968m	802.418	813.906	иии захотелось во-первых собрать группу для для концертов / именно под этот материал аaa a во-вторых этот материал записать //
text@kua1968m	@kua1968m	814.232	829.273	и вот эээ тут э о чём я говорил в начале да? Зимовье как бы с... само вело ме.. он... оно снова меня / вот забрало поставило на это место и сказало возвращай название возвращай дух группы / эээ и продолжай эту историю / так что эээ //
text@kua1968m	@kua1968m	830.247	840.046	теперь / Зимовье существует да но всё равно ааа / мы не можем например там очень часто давать концерты / во всяком случае щас такой ещё возможности не не появилось //
text@kua1968m	@kua1968m	840.32	854.44	поэтому я выступаю с гитарой продолжаю выступать я вот осенью ездил там в Германию / например с большим туром / да но это / это для меня разные чуть-чуть истории ра... разный опыт хотя песни одни и те же //
text@kua1968m	@kua1968m	855.18	873.78	но эээ я получаю / свои какие-то эмоции удовлетворение от эээ разных выступлений то есть мне нравится и / там квартирники играть / это одно ощущение / и с эээ Зимовьем с электрическим Зимовьем на какой-то большой сцене / это другая история //
text@kua1968m	@kua1968m	873.8	891.694	а эээ то что ты говоришь что распалось из-за в... из-за этого нет как раз эээ в... тут были в... внутригрупп... групповые причины это к моим / моему комфорту или дискомфорту на на сцене не относится мне мне одинаково дис... эээ мне дискомфортно хотел сказать одинаково
text@kua1968m	@kua1968m	891.8	909.66	#смеется# одинаково комфортно и на маленькой сцене и на на большой если / эээ ну если всё идёт хорошо да если есть какой-то контакт с залом и если есть настрой / да и одинаково дискомфортно если этого нет в большом зале или в маленьком //
text@kua1968m	@kua1968m	914.2	914.92	да //
text@kua1968m	@kua1968m	920.58	933.64	да вообще / очень странная у меня история / я такой человек наверно / я во-первых ленивый / а в во-вторых я привык свою лень выдавать эээ в каком-то смысле за своё кредо за свои принципы //
text@kua1968m	@kua1968m	933.82	945.02	мне лень было / учиться играть на гитаре / и поэтому я придумал себе а ведь я такой особенный / я / пою без гитары / вот я такое даже слово придумал суперакустика //
text@kua1968m	@kua1968m	945.2	970.1	я п... сочинял песни они сочинялись уже там с мелодией со всем но я их / эээ пел не на гитаре аккомпанируя а либо там подстукивал вот / по коленке либо ещё была такая история вот первые квартирные концерты там в начале девяностых / ммм мелочь в карманах причём когда мелочи не хватало мне люди просто собирали мелочь вот те кто слушал да я / насыпал в карман и так по... по... позвякивая пел эти песни //
text@kua1968m	@kua1968m	970.79	984.29	и так продолжалось довольно долго к... когда существовало Зимовье Зверей я несколько раз что-то б... ммм заикался насчёт может мне научиться на гитаре / а мне Саша Петерсон говорил нет не надо тебе не надо играть на гитаре лучше / пой //
text@kua1968m	@kua1968m	984.533	988.836	а потом ммм прошло какое-то время как раз уже Зимовье распалось //
text@kua1968m	@kua1968m	989.487	997.022	и вдруг / я что-то взял гитару мне жена моя Саша показала там / три аккорда которые она знает //
text@kua1968m	@kua1968m	997.325	1011.883	я / попробовал / отложил потом ещё раз попробовал / отложил / а на третий раз как в сказке да? попробовал / и вдруг что-то понял как это одно с другим сочетается / понял механизм //
text@kua1968m	@kua1968m	1012.046	1024.325	и дальше / и дальше я понял что конечно каких-то таких эээ гитарных высот как музыкант я уже эээ не достигну ну просто потому что я в сорок лет взял гитару в руки //
text@kua1968m	@kua1968m	1024.487	1034.5	но / сопровождать эээ свои выступления с... сам себе аккомпанировать в общем / ритмическую какую-то музыкальную основу давать я могу //
text@kua1968m	@kua1968m	1034.5	1050.953	я не играю там перебором но ритм я отбиваю вот чувство ритма у меня в общем-то / есть и было я когда сочинял песни я иногда бр... брал в руки гитару / но не зажимая аккордов просто вот по по ней так / ммм по струнам позвякивал и под это сочинял / вот //
text@kua1968m	@kua1968m	1054.527	1076.959	эээ нет не играю / к сожалению я ну вот я вообще ни на чём я когда-то в школе учился играть на пианино то есть я / там скажем месяц по-моему или два учился у меня была очень хорошая / у... учительница / эээ она у нас пение преподавала и в свободное / от эээ работы время она занималась с несколькими / ребятами она вот отобрала в том числе меня //
text@kua1968m	@kua1968m	1077.332	1096.863	и мы с ней эээ п... от... отзан... отзанимались несколько занятий всё было очень хорошо / ей очень нравилось как я занимаюсь / но тут её уволили то... я даже щас думаю что может её уволили за левые какие-то занятия может она это незаконно их проводила да? / но / уже за давностью лет н... не вспомнить этого ка... как это случилось никто не знает //
text@kua1968m	@kua1968m	1097.055	1109.126	но / с тех пор всё / эээ вот я сказал что я у других / заниматься не буду / она / она вообще очень на меня повлияла я к сожалению даже не помню её имя это было там в... / во втором или в третьем классе //
text@kua1968m	@kua1968m	1109.888	1125.821	ааа она меня водила в филармонию она первая меня вот / сводила там в филармонию / я послушал классическую музыку / вообще я как-то вошёл очень в эту тему и когда вот её уволили / и выгнали из нашей школы я просто вот как бы нет я с другими я не буду заниматься //
text@kua1968m	@kua1968m	1126.027	1135.388	и опять-таки вот какие-то такие вот принципы которые / отчасти мне мешают всю жизнь а иногда помогают если я вот говорю что я не буду заниматься значит я не буду за... #смеется# заниматься //
text@dd1982m	@dd1982m	714.99	716.72	я где-то читал что//
text@dd1982m	@dd1982m	717.804	726.496	одна из эээ причин / распада Зимовья Зверей была в том что / тебе не очень комфортно было выступать на больших площадках и / так сказать //
text@dd1982m	@dd1982m	726.782	735.043	в виде какой-то там рок-звезды ты себя не особо видел тебе было комфортно на / более маленьких сценах то есть более акустические камерные какие-то / концерты //
text@dd1982m	@dd1982m	741.468	750.829	но а смотри а в... то есть / сейчас вот / как бы я со стороны вижу ситуацию таким образом мы вот с тобой познакомились несколько лет назад когда Зимовье Зверей / не собралось в таком виде как сейчас //
text@dd1982m	@dd1982m	750.922	758.105	и получается ты играл акустические концерты / да ездил там вот с акустической гитарой / эээ выступал / и я так понимаю что //
text@dd1982m	@dd1982m	759.028	768.658	ааа количество людей которые сейчас приходят на концерты Зимовья Зверей / то есть в разы эээ так сказать отличается от количества людей которые приходили на сольные концерты акустические да? //
text@dd1982m	@dd1982m	769.0	778.127	то наверно в какой-то момент эээ тебе просто это надоело история с этими акустиками всеми непонятными и ты просто решил это всё эээ возродить вот как-то я это так вижу со стороны //
text@dd1982m	@dd1982m	778.71	780.454	ну потому что мне кажется что это //
text@dd1982m	@dd1982m	887.14	888.274	ну / я имею в виду //
text@dd1982m	@dd1982m	909.56	914.58	слушай а я насколько знаю / ты не так давно ведь эээ играешь на гитаре да? //
text@dd1982m	@dd1982m	914.92	920.56	то есть у тебя не такая история как у всех что с детства там ну / играл на гитаре сочинял песни и потом / там / всё //
text@dd1982m	@dd1982m	1050.976	1054.384	а д... на других эээ инструментах ты не играешь музыкальных? //
gesture@kua1968m	@kua1968m	736.096	736.545	левой рукой опирается на подлокотник, постукивает кистью по воздуху, выставив указательный палец
gesture@kua1968m	@kua1968m	738.041	738.948	левой рукой опирается на подлокотник, постукивает кистью по воздуху, выставив указательный палец
gesture@kua1968m	@kua1968m	740.082	740.365	левой рукой опирается на подлокотник, постукивает кистью по воздуху, выставив указательный палец
gesture@kua1968m	@kua1968m	767.902	768.647	коротко кивает
gesture@kua1968m	@kua1968m	781.67	783.198	имитирует игру на гитаре обеими руками
gesture@kua1968m	@kua1968m	783.898	786.832	поворачивает руки ладонью вверх, опираясь локтями на подлокотники, потряхивая ими в такт речи
gesture@kua1968m	@kua1968m	788.924	802.16	поворачивает руки ладонью вверх, опираясь локтями на подлокотники, потряхивая ими в такт речи много раз
gesture@kua1968m	@kua1968m	803.086	810.258	поднимает руки на уровень груди и очерчивает ладонями полукруг несколько раз
gesture@kua1968m	@kua1968m	811.789	815.345	поднимает руки на уровень груди и очерчивает ладонями полукруг один раз
gesture@kua1968m	@kua1968m	815.345	817.086	указывает на себя согнутыми ладонями несколько раз
gesture@kua1968m	@kua1968m	817.11	819.122	покачивает согнутыми ладонями в воздухе несколько раз
gesture@kua1968m	@kua1968m	819.134	822.357	сводит руки ближе и изображает движение, как будто ставит что-то
gesture@kua1968m	@kua1968m	822.358	827.962	сведёнными на расстоянии параллельно руками покачивает в такт речи
gesture@kua1968m	@kua1968m	828.678	833.444	поднимает руки на уровень груди и делает круговые движения ладонями
gesture@kua1968m	@kua1968m	833.444	839.357	сводит и разводит руки два раза
gesture@kua1968m	@kua1968m	840.776	844.147	поочередно разводит руки в стороны, затем сводит обратно
gesture@kua1968m	@kua1968m	844.159	847.098	обе руки двигает параллельно влево
gesture@kua1968m	@kua1968m	849.16	852.999	двигает руки параллельно друг другу из стороны в сторону, постепенно сближая ладони
gesture@kua1968m	@kua1968m	853.024	854.925	разводит руками и снова сводит
gesture@kua1968m	@kua1968m	856.431	860.974	держит ладони на уровне плеч и очерчивает ими круги несколько раз
gesture@kua1968m	@kua1968m	861.95	865.012	два раза опускает руки ладонями вниз на воздух, как на горизонтальную плоскость
gesture@kua1968m	@kua1968m	865.567	877.814	разводит руками несколько раз
gesture@kua1968m	@kua1968m	881.863	882.9	размыкает руки и как бы отодвигает что-то в воздухе один раз ладонями вниз
gesture@kua1968m	@kua1968m	883.085	884.702	держит руки на уровне груди и совершает ладонями круговые движения, ладони направлены к телу
gesture@kua1968m	@kua1968m	884.801	886.307	поводит руками из стороны в сторону, ладони направлены друг к другу
gesture@kua1968m	@kua1968m	886.406	886.974	слегка покачивает головой
gesture@kua1968m	@kua1968m	887.147	887.912	поднимает руки на уровень плеч и встряхивает кистями рук
gesture@kua1968m	@kua1968m	888.086	888.975	поднимает руки ладонями к собеседнику и делает в сторону него отодвигающее  движение
gesture@kua1968m	@kua1968m	889.073	890.727	указывает на собеседника и наклоняется вперёд
gesture@kua1968m	@kua1968m	893.838	894.653	левая рука поднята на уровень плеч, взмахивает ей в сторону собеседника один раз
gesture@kua1968m	@kua1968m	894.715	898.74	выпрямленной ладонью левой руки поводит из стороны в сторону несколько
gesture@kua1968m	@kua1968m	898.752	903.27	разведёнными руками поводит из стороны в сторону несколько раз, ладони направлены друг к другу
gesture@kua1968m	@kua1968m	903.579	904.369	делает круговое движение руками на уровне пояса
gesture@kua1968m	@kua1968m	905.185	907.308	разводит руками
gesture@kua1968m	@kua1968m	907.327	909.265	поднимает руки вверх и вправо, затем опускает к животу
gesture@kua1968m	@kua1968m	917.709	918.585	короткий кивок
gesture@kua1968m	@kua1968m	925.443	930.628	поочерёдно загибает два пальца на левой руке, начиная с мизинца
gesture@kua1968m	@kua1968m	933.839	936.703	сжатой в кулак ладонью качает в сторону собсесдника
gesture@kua1968m	@kua1968m	936.727	944.875	несколько раз показывает на себя и в сторону открытой ладонью левой руки
gesture@kua1968m	@kua1968m	944.913	949.9	поднимает обе руки с раскрытыми ладонями на уровень плеч и поводит ими из стороны в сторону несколько раз
gesture@kua1968m	@kua1968m	951.363	952.647	имитирует игру на гитаре обеими руками
gesture@kua1968m	@kua1968m	952.727	955.801	ритмично стучит ладонями по бедру
gesture@kua1968m	@kua1968m	955.949	956.974	двигает руку тыльной стороной к собеседнику
gesture@kua1968m	@kua1968m	957.146	958.257	очерчивает руками сферу
gesture@kua1968m	@kua1968m	960.127	962.608	залезает правой рукой в карман брюк
gesture@kua1968m	@kua1968m	962.657	964.506	обводит руками пространство вокруг себя и складывает руки
gesture@kua1968m	@kua1968m	964.533	966.36	залезает правой рукой в карман брюк
gesture@kua1968m	@kua1968m	966.378	970.008	трясёт кистью правой руки около кармана брюк
gesture@kua1968m	@kua1968m	971.073	979.221	поднимает левую руку с открытой ладонью и слегка потряхивает ей несколько раз
gesture@kua1968m	@kua1968m	979.282	984.122	машет кистью руки несколько раз
gesture@kua1968m	@kua1968m	986.703	988.715	несколько раз свожит и разводит руки на уровне груди
gesture@kua1968m	@kua1968m	990.197	991.061	пожимает плечами
gesture@kua1968m	@kua1968m	998.579	1004.641	покачивает руками из стороны в сторону
gesture@kua1968m	@kua1968m	1004.647	1010.301	имитирует игру на гитре
gesture@kua1968m	@kua1968m	1010.517	1011.036	показывает левой рукой в сторону собеседника
gesture@kua1968m	@kua1968m	1016.346	1024.95	разводит руками и слегка поводит кистями
gesture@kua1968m	@kua1968m	1026.196	1027.554	раскрывает ладони и слегка двигает ими вперёд
gesture@kua1968m	@kua1968m	1027.572	1030.622	показывает на себя обеими руками несколько раз
gesture@kua1968m	@kua1968m	1041.213	1050.034	имитирует игру на гитаре
gesture@kua1968m	@kua1968m	1057.715	1058.665	разводит руками
gesture@kua1968m	@kua1968m	1064.233	1067.443	поднимает руки и слегка покачивет ими
gesture@kua1968m	@kua1968m	1067.728	1072.518	поводит руками влево, затем вправо
gesture@kua1968m	@kua1968m	1072.53	1077.172	покачивает ладонями, держа руки на уровне груди
gesture@kua1968m	@kua1968m	1077.351	1081.178	имитирует игру на фортепиано
gesture@kua1968m	@kua1968m	1081.245	1084.949	взмахивает обеими руками несколько раз
gesture@kua1968m	@kua1968m	1085.479	1086.899	разводит руками
gesture@kua1968m	@kua1968m	1087.863	1091.703	отводит обе руки вправо
gesture@kua1968m	@kua1968m	1092.158	1093.22	разводит руками
gesture@kua1968m	@kua1968m	1095.207	1096.553	разводит руками
gesture@kua1968m	@kua1968m	1097.904	1100.608	разводит руками
gesture@kua1968m	@kua1968m	1100.626	1103.206	покачивает разведёнными руками несколько раз
gesture@kua1968m	@kua1968m	1104.197	1105.654	указывает на себя
gesture@kua1968m	@kua1968m	1106.801	1108.529	показывает один палец правой рукой
gesture@kua1968m	@kua1968m	1110.727	1114.307	поднимает правую руку и покачивает ей
gesture@kua1968m	@kua1968m	1114.616	1116.406	машет рукой в сторону
gesture@kua1968m	@kua1968m	1117.017	1118.832	поднимает и опускает руки
gesture@kua1968m	@kua1968m	1118.924	1121.839	делает круговые движения кистью
gesture@kua1968m	@kua1968m	1123.541	1124.887	отодвигает руки от себя
gesture@kua1968m	@kua1968m	1127.813	1128.221	коротко встряхивает правой рукой
gesture@kua1968m	@kua1968m	1129.357	1131.332	коротко приподнимает и опускает руки два раза
gesture@kua1968m	@kua1968m	1131.744	1132.559	приподнимает руку
gesture@kua1968m	@kua1968m	1132.961	1133.837	взмахивает рукой
gestMeaning@kua1968m	@kua1968m	736.096	736.545	жест внутреннего состояния (задуматься)
gestMeaning@kua1968m	@kua1968m	738.041	738.948	поддержка собственной коммуникации
gestMeaning@kua1968m	@kua1968m	740.082	740.365	поддержка собственной коммуникации
gestMeaning@kua1968m	@kua1968m	767.902	768.647	речевое действие (подтверждение)
gestMeaning@kua1968m	@kua1968m	781.67	783.198	изобразительный жест (играть на гитаре)
gestMeaning@kua1968m	@kua1968m	783.898	786.832	поддержка собственной коммуникации
gestMeaning@kua1968m	@kua1968m	788.924	802.16	риторический жест(подчеркивать ритм фразы)
gestMeaning@kua1968m	@kua1968m	803.086	810.258	изобразительный жест (собрать группу)
gestMeaning@kua1968m	@kua1968m	811.789	815.345	поддержка собственной коммуникации
gestMeaning@kua1968m	@kua1968m	815.345	817.086	дейктический жест (самоидентификация)
gestMeaning@kua1968m	@kua1968m	817.11	819.122	изобразительный жест (вести)
gestMeaning@kua1968m	@kua1968m	819.134	822.357	изобразительный жест (поставить)
gestMeaning@kua1968m	@kua1968m	822.358	827.962	речевое действие (перечисление)
gestMeaning@kua1968m	@kua1968m	828.678	833.444	поисковый жест (поиск слова)
gestMeaning@kua1968m	@kua1968m	833.444	839.357	жест внутреннего состояния (что тут поделаешь!)
gestMeaning@kua1968m	@kua1968m	840.776	844.147	дейктический жест (общеуказательный)
gestMeaning@kua1968m	@kua1968m	844.159	847.098	дейктический жест (общеуказательный)
